{
  "$schema": "http://json-schema.org/draft-07/schema#",
  "$id": "https://beijiaogame.local/schema/level.schema.json",
  "title": "关卡配置",
  "description": "《知行谜站》单关配置格式。与 assets/scripts/common/LevelTypes.ts 一一对应，改一边必须改另一边。9/22 冻结的五个字段：levelId / viewId / assetKey / nodeId / progress。",
  "type": "object",
  "required": [
    "levelId",
    "chapterId",
    "title",
    "mode",
    "views",
    "hints",
    "rewards"
  ],
  "additionalProperties": false,
  "properties": {
    "_note": {
      "type": "string",
      "description": "给 A/B/D 看的占位说明，程序会忽略这个字段。正式关卡定稿后应删除。"
    },
    "levelId": {
      "type": "string",
      "minLength": 1,
      "description": "【冻结字段】关卡标识。引导关固定为 GUIDE，正式关为 L01~L10。"
    },
    "chapterId": {
      "type": "string",
      "minLength": 1,
      "description": "所属地图章节。10 关按 5 个章节组织，每章 2 关。"
    },
    "title": {
      "type": "string",
      "minLength": 1,
      "description": "关卡名，显示在开场和结算页。"
    },
    "mode": {
      "type": "array",
      "minItems": 1,
      "uniqueItems": true,
      "items": {
        "enum": [
          "solo",
          "duo"
        ]
      },
      "description": "本关支持的模式。MVP 每关都要求 solo 和 duo 都能进。"
    },
    "timeLimitSec": {
      "type": "number",
      "exclusiveMinimum": 0,
      "description": "倒计时秒数。不填表示不限时（引导关建议不限时）。"
    },
    "items": {
      "type": "object",
      "minProperties": 1,
      "additionalProperties": {
        "oneOf": [
          {
            "type": "string",
            "minLength": 1
          },
          {
            "type": "object",
            "required": [
              "name"
            ],
            "additionalProperties": false,
            "properties": {
              "name": {
                "type": "string",
                "minLength": 1,
                "description": "玩家看得见的名字"
              },
              "desc": {
                "type": "string",
                "minLength": 1,
                "description": "一句话说明。背包里选中它时显示在名字下面"
              },
              "iconKey": {
                "type": "string",
                "minLength": 1,
                "description": "图标 key（assets/resources/ 下的路径，如 details/frag_1）。不填就只显示名字"
              },
              "hidden": {
                "type": "boolean",
                "description": "只在程序内部流转、不进背包面板。第 2 关的「已归位碎片」用它"
              }
            }
          }
        ]
      },
      "description": "道具 id → 玩家看得见的东西。**写字符串 = 只给名字**（老配置不用改）；要图标 / 说明 / 「不进背包」就写成对象 { name, desc?, iconKey?, hidden? }。"
    },
    "views": {
      "type": "object",
      "description": "两个视角的画面数据。A 和 B 都必须存在。",
      "required": [
        "A",
        "B"
      ],
      "additionalProperties": false,
      "properties": {
        "A": {
          "$ref": "#/definitions/view"
        },
        "B": {
          "$ref": "#/definitions/view"
        }
      }
    },
    "puzzle": {
      "type": "object",
      "required": [
        "type",
        "submitNodeId",
        "answer"
      ],
      "additionalProperties": false,
      "properties": {
        "type": {
          "enum": [
            "route_rebuild",
            "number_match",
            "time_order",
            "item_combine"
          ],
          "description": "谜题类型。前三类对应需求评审 FR-07 要求 MVP 支持的三类。"
        },
        "submitNodeId": {
          "type": "string",
          "minLength": 1,
          "description": "【冻结字段】提交热点的 nodeId，必须指向一个 action 为 submit 的真实热点。**两种输入方式都必填**，只是含义不同：input 为 none 时点它直接提交；input 为 numberpad / form 时点它**打开输入面板**（面板默认关着，常驻会挡住大半个场景）。"
        },
        "input": {
          "enum": [
            "none",
            "numberpad",
            "form"
          ],
          "description": "玩家怎么把答案输进去。不写 = none，靠点热点提交。numberpad = 屏幕数字键盘（answer 必须是单个 0-9 组成的数组）；form = 逐项选择填空（answer 必须是对象，且要给 fieldOptions）。"
        },
        "fieldOptions": {
          "type": "object",
          "minProperties": 1,
          "additionalProperties": {
            "type": "array",
            "minItems": 1,
            "items": {
              "type": "string"
            }
          },
          "description": "input 为 form 时每个空的可选项。键必须和 answer 的键完全一致，且**每个空的正确答案必须出现在自己的候选项里** —— 少了就是永远填不对的死局，校验层会拦。候选项里混干扰项是有意的，选错也是玩法。"
        },
        "answer": {
          "description": "标准答案。**形状决定怎么判**：数组 = 有序答案（逐位相等，用于数字密码、路线顺序、背包顺序）；对象 = 按键答案（键集合相同且每键的值相等，顺序无关，用于表单填空、拖放到位、单选）。",
          "oneOf": [
            {
              "type": "array",
              "minItems": 1,
              "items": {
                "type": "string"
              },
              "description": "有序答案。例：数字密码 [\"2\",\"4\",\"1\"]；道具序列 [\"road_north\",\"road_west\"]。"
            },
            {
              "type": "object",
              "minProperties": 1,
              "additionalProperties": {
                "type": "string",
                "minLength": 1
              },
              "description": "按键答案。例：表单 { \"岗位\": \"接线员\", \"编号\": \"07\", \"地点\": \"南门内侧\" }。单选只有一个键。"
            }
          ]
        },
        "requiredItems": {
          "type": "array",
          "items": {
            "type": "string"
          },
          "description": "提交前必须已在背包里的道具。写错会导致死局，校验层会拦。"
        },
        "maxAttempts": {
          "type": "integer",
          "minimum": 1,
          "description": "容错次数，超过判失败。不填默认 3。"
        },
        "wrongCooldownSec": {
          "type": "number",
          "exclusiveMinimum": 0,
          "description": "答错后锁多少秒不能重交。**不填 = 只提示错误、不做任何惩罚**；不要写 0，不惩罚就整个字段别写。"
        }
      },
      "description": "通关条件之一：回答一个问题（点热点提交，或用数字键盘/表单输入）。**可以整个不写** —— 那种关卡靠一个标了 completes: true 的 use 热点通关。两者至少要有一个：两个都没有就是永远通不了。"
    },
    "hints": {
      "type": "array",
      "minItems": 1,
      "items": {
        "type": "string"
      },
      "description": "提示梯度，按顺序逐条解锁。项目约定每关 3 段。"
    },
    "rewards": {
      "type": "object",
      "required": [
        "progress"
      ],
      "additionalProperties": false,
      "properties": {
        "progress": {
          "type": "array",
          "items": {
            "type": "string"
          },
          "description": "【冻结字段】通关后解锁的地图节点，E 的地图按这个挂入口。"
        }
      }
    }
  },
  "definitions": {
    "view": {
      "type": "object",
      "required": [
        "hotspots"
      ],
      "additionalProperties": false,
      "properties": {
        "viewId": {
          "enum": [
            "A",
            "B"
          ],
          "description": "【冻结字段】可省略，以键名为准；写了就必须和键名一致。"
        },
        "assetKey": {
          "type": "string",
          "minLength": 1,
          "description": "【单场景视角】A/B 按这个命名出图，如 bg/L01_A。和 scenes **二选一** —— 一个视角只有一张图的关卡用这个；要按剧情切图的（第 2 关 A 视角）用 scenes。"
        },
        "hotspots": {
          "type": "array",
          "items": {
            "$ref": "#/definitions/hotspot"
          }
        },
        "initialScene": {
          "type": "string",
          "minLength": 1,
          "description": "【多场景视角】进关卡 / 「再来一次」后先显示哪个场景。写了 scenes 就必须写它。"
        },
        "scenes": {
          "type": "object",
          "minProperties": 1,
          "description": "【多场景视角】场景 id → 场景。**该视角的每个热点都要写 scene**（校验层强制）—— 不写的话它会每个场景都出现。",
          "additionalProperties": {
            "type": "object",
            "required": [
              "assetKey"
            ],
            "additionalProperties": false,
            "properties": {
              "assetKey": {
                "type": "string",
                "minLength": 1,
                "description": "这个场景的背景图，如 bg/L02_A_1。"
              },
              "backScene": {
                "type": "string",
                "minLength": 1,
                "description": "「返回」回到哪个场景。**不写 = 这个场景没有返回出口**（岔路场景不写）。写了的话界面会在**左下角**放一个固定的「返回」按钮 —— 那个按钮不占原图坐标，A/B 不用管。"
              }
            }
          }
        }
      }
    },
    "hotspot": {
      "type": "object",
      "required": [
        "nodeId",
        "rect",
        "action"
      ],
      "additionalProperties": false,
      "properties": {
        "nodeId": {
          "type": "string",
          "minLength": 1,
          "description": "【冻结字段】热点唯一标识，同一关内不可重复。"
        },
        "rect": {
          "type": "array",
          "minItems": 4,
          "maxItems": 4,
          "items": {
            "type": "number"
          },
          "description": "可点击区域 [x, y, w, h]。以【原图左上角】为原点，单位是原图像素，直接量原图，不用管屏幕尺寸。"
        },
        "action": {
          "enum": [
            "pickup",
            "inspect",
            "submit",
            "use",
            "goto"
          ],
          "description": "pickup 拾取道具 / inspect 给一段文字 / submit 提交答案 / use 在装置上使用一件道具（玩家自己从背包挑，可以挑错）"
        },
        "itemId": {
          "description": "pickup 拿到的道具。写字符串是拿一件，写数组是**一次拿多件**（第 1 关的工具盒同时给蓝方印章和磁吸杆）。",
          "oneOf": [
            {
              "type": "string",
              "minLength": 1
            },
            {
              "type": "array",
              "minItems": 1,
              "items": {
                "type": "string"
              }
            }
          ]
        },
        "text": {
          "type": "string",
          "description": "action 为 inspect 时展示的文案。"
        },
        "requiresItem": {
          "oneOf": [
            {
              "type": "string",
              "minLength": 1
            },
            {
              "type": "array",
              "minItems": 1,
              "items": {
                "type": "string",
                "minLength": 1
              }
            }
          ],
          "description": "需要背包里有该道具才可点。写数组 = 这几件都得有（第 2 关拼合要三块齐）。和 acceptedItems 的区别：acceptedItems 是「用哪一件」（要先在背包里选中），requiresItem 是「手上有这个才能点」（不涉及选择）。"
        },
        "revealsNode": {
          "type": "string",
          "description": "点击后揭示另一个 nodeId（通常在另一视角），对应游戏的信息差机制。"
        },
        "hiddenByDefault": {
          "type": "boolean",
          "description": "初始不可见，被别人的 revealsNode 揭示后才出现。"
        },
        "acceptedItems": {
          "type": "array",
          "minItems": 1,
          "items": {
            "type": "string"
          },
          "description": "【action 为 use 时必填】认可哪些道具。玩家从背包里挑中的那件在列表里才算对。挑错是**软拒绝**：不扣容错次数、不触发惩罚 —— 翻物件本来就是探索。设计稿里「红圆章是辨析项」靠的就是这一步。"
        },
        "choices": {
          "type": "array",
          "minItems": 1,
          "items": {
            "type": "string"
          },
          "description": "【action 为 use 时】现场摆着的几个固定选项，玩家选一个。和 acceptedItems 的区别：这里的选项**不来自背包**（三条岔路、三张通知）。三个输入门任选其一：code → 数字键盘 / acceptedItems → 背包列表 / choices → 选项列表。选错是软拒绝。"
        },
        "correctChoice": {
          "type": "string",
          "minLength": 1,
          "description": "choices 里哪个对。**必须出现在 choices 里**，否则玩家选遍所有选项也过不去（校验层会拦）。"
        },
        "consumes": {
          "type": "array",
          "items": {
            "type": "string"
          },
          "description": "【action 为 use 时】成功后消耗掉的道具。**不填 = 什么都不消耗**（磁吸杆那种可重复用的）。这里列的道具玩家必须都持有，否则用不了。"
        },
        "prompt": {
          "type": "string",
          "minLength": 1,
          "description": "【action 为 use 时】打开输入面板时显示的那句话。**不填会出问题**：B 点地图上的空缺时面板只说「选哪个？」，玩家不知道这是哪一块。场景里几个装置长得像的时候，这句是唯一的区分。"
        },
        "produces": {
          "description": "【action 为 use 时】成功后产出的新道具。字符串 = 一件，数组 = 一次多件（工具盒同时给印章和磁吸杆）。产出物也算「拿得到」，可以给别的热点当 requiresItem / acceptedItems。",
          "oneOf": [
            {
              "type": "string",
              "minLength": 1
            },
            {
              "type": "array",
              "minItems": 1,
              "items": {
                "type": "string"
              }
            }
          ]
        },
        "successText": {
          "type": "string",
          "description": "用成功后说的一句话，让玩家知道发生了什么。"
        },
        "detailKey": {
          "type": "string",
          "minLength": 1,
          "description": "特写图（放大图）的资源 key，放在 assets/resources/details/ 下，例如 details/GUIDE_A_notice。只让玩家看清细节，图本身不能互动，只有一个关闭按钮。触发时机按 action 分：inspect 点击时弹；use 操作成功后才弹。不填 = 没有特写图。图找不到时只打日志、不弹，原有文字和面板照常。"
        },
        "rejectText": {
          "type": "string",
          "description": "挑错道具时说的一句话。"
        },
        "code": {
          "type": "array",
          "minItems": 1,
          "items": {
            "type": "string",
            "pattern": "^[0-9]$"
          },
          "description": "【action 为 use 时】要输的密码，逐个一位 0-9。给了它就**不弹道具列表、改弹数字键盘**。这样一关可以有多个密码门：puzzle 只管最后那一下，中间的工具盒/保险柜各自带自己的 code。默认输错是**软拒绝**；要罚就配 wrongCooldownSec。"
        },
        "wrongCooldownSec": {
          "type": "number",
          "exclusiveMinimum": 0,
          "description": "【只对配了 code 的密码门有效】输错密码后罚站多少秒。不填 = 完全不罚。罚站期间这台装置点不开、也不收密码，左上角显示「⏳ N 秒」倒着走；每次输错都罚，不封顶。"
        },
        "completes": {
          "type": "boolean",
          "description": "【action 为 use 时】用成功后这关就通了。**一关的通关条件要么是 puzzle，要么是这个。** 适合「最后一步是操作而不是答题」的关卡，比如第 1 关把凭证插进柜子。"
        },
        "scene": {
          "type": "string",
          "minLength": 1,
          "description": "【只在写了 scenes 的视角里有意义】这个热点属于哪个场景。写了就只在该场景出现、也只有那时能点。"
        },
        "gotoScene": {
          "type": "string",
          "minLength": 1,
          "description": "【action 为 goto 或 use 时】点了（goto）/ 用成功后（use）切到哪个场景，必须是本视角里存在的场景 id。goto 是纯导航：不拿道具、不给文字、不消耗次数。"
        },
        "requireText": {
          "type": "string",
          "minLength": 1,
          "description": "【配合 requiresItem 用】缺了那件道具时说的话。不填就说通用的「还差点东西，先去找找。」。第 2 关的岔路用它是为了说清「缺的是同伴拼好的路线图」，不然玩家捡完碎片会以为游戏坏了。"
        }
      }
    }
  }
}
